{
  "schemaVersion":"capture-protocol-1.0",
  "probe":"probe.json",
  "protocolName":"逐题答案—卷面批注—冲突—考试闭环协议",
  "rationale":"该视频的认知变化依赖69条讲解字幕、整页试卷、逐步增加的红色答案、讲解者画中画和考试设定闭环；协议重点核查20题答案、疑似ASR冲突、批注前后状态、身份边界及全片缺失条件。",
  "knowledgeUnitFields":[
    {"name":"question_number_and_prompt","required":true,"reason":"保留20题的组织结构。","derivedFrom":["CQ-02","CAR-DOC"]},
    {"name":"author_answer_or_claim","required":true,"reason":"认知变化的核心是作者答案，必须保持author_claim。","derivedFrom":["CQ-02","RISK-01"]},
    {"name":"visible_mark_or_text","required":true,"reason":"连接语音答案与卷面红色批注。","derivedFrom":["REL-03","CAR-INK"]},
    {"name":"carrier_conflict","required":false,"reason":"若干SRT词疑似错误，不能静默归一。","derivedFrom":["CQ-05","RISK-02"]},
    {"name":"scope_and_unknowns","required":true,"reason":"平台、数据、身份、连续性和获取路径未建立。","derivedFrom":["CQ-06","CQ-07","CQ-09","RISK-06"]},
    {"name":"cross_question_relation","required":true,"reason":"选择题与填空题重复，结尾回扣开场。","derivedFrom":["REL-02","REL-05"]}
  ],
  "captureActions":[
    {"id":"ACT-OPEN","range":{"start":0,"end":10.782},"carrier":"inserted clip, burned caption, document, presenter, overlay, watermark","mode":"ocr_review","times":[0.5,2.5,5.5,8.5,10.5],"reason":"捕获0至1.133秒插入画面及来源/权属边界，再读取试卷标题、账号标签并界定面罩人物。","expectedObservation":"模糊插入画面与‘开头展示教程’字幕、随后转入仿统一考试标题、可见账号文字、小红书标识、人物外观与第一题开始；插入素材来源/权属保持未知。","derivedFrom":["MC-00","REL-00","CAR-OPEN-INSERT","MC-01","CQ-01","RISK-04"]},
    {"id":"ACT-Q1-8","range":{"start":10.782,"end":116.795},"carrier":"document text, burned captions, red ink, gesture","mode":"ocr_review","times":[12,18.8,25,30,34,40,48.5,55,61,67,72,79,85,92,99,104.5,109,113.5,116],"reason":"覆盖8道选择题与答案，针对冲突时段加密。","expectedObservation":"题号、选项/填空可读片段、红笔A/B/C/D及疑似‘万古同杯/头脑风暴’等原词。","derivedFrom":["MC-02","CQ-02","CQ-05","RISK-02"]},
    {"id":"ACT-TRANSITION","range":{"start":114.62,"end":122},"carrier":"speech/caption, document layout, red ink state","mode":"before_during_after","times":[115,118,121.5],"reason":"确认选择题结束到填空题开始及卷面状态变化。","expectedObservation":"选择题完成状态、填空题区域开始和固定画中画布局。","derivedFrom":["MC-03","RISK-03"]},
    {"id":"ACT-Q9-20","range":{"start":119.96,"end":210.52},"carrier":"document text, burned captions, red ink","mode":"ocr_review","times":[122,127,132,136,140,145,149,153,157,161,165,168,171.5,175.5,180,184,189,193.5,198,204,208.5],"reason":"覆盖12道填空题及与前文重复概念。","expectedObservation":"题号9-20、手写答案、六类需求/爆款类型/文本要求等疑似冲突文字与最终卷面累积。","derivedFrom":["MC-04","CQ-02","CQ-03","CQ-05","REL-02"]},
    {"id":"ACT-CONTINUITY","range":{"start":0,"end":218.082},"carrier":"technical shots, document state, presenter setting","mode":"exact_times","times":[0.5,105.8,214.2,217.5],"reason":"比较3个技术shot边界与全片语义连续性，避免宣称编辑次数。","expectedObservation":"相同试卷主画面和右下画中画构图，红笔状态不同；隐藏剪辑仍未知。","derivedFrom":["CAR-EDIT","CQ-07","RISK-03"]},
    {"id":"ACT-CLOSE","range":{"start":210.52,"end":218.082},"carrier":"caption, presenter, document, CTA/absence scope","mode":"ocr_review","times":[211,214,216.7,217.9],"reason":"捕获90分鼓励、署名告别和获取/边界元素的末尾机会窗。","expectedObservation":"‘90分’语义、讲解者署名、账号水印；核查是否出现获取试卷CTA或政策来源。","derivedFrom":["MC-05","REL-05","CQ-08","CQ-09","RISK-06"]}
  ],
  "requiredRelations":[
    {"relation":"insert_transitions_to_exam_setup","derivedFrom":["REL-00"]},
    {"relation":"setup_to","derivedFrom":["REL-01"]},
    {"relation":"selection_questions_revisited_by_fill_blanks","derivedFrom":["REL-02"]},
    {"relation":"spoken_answer_mapped_to_visible_mark","derivedFrom":["REL-03"]},
    {"relation":"presenter_referent_associated_with_visible_account_label","derivedFrom":["REL-04"]},
    {"relation":"payoff_for","derivedFrom":["REL-05"]}
  ],
  "stoppingRules":["20道题的作者答案均进入知识单元或明确未知","所有69条cue均被accountability覆盖","疑似冲突词已检查OCR/帧且不能确定者保留原SRT与未知","开场考试设定与结尾90分回扣均入关系图","技术shot未被升级为语义场景/剪辑次数","全片音频、文档、字幕、批注、人物、布局、水印均检查或明确未知","获取路径、平台/地区/账号/来源等只作完整时间线范围内的缺失观察","meta-gate无未检查载体、意义变化或关系"],
  "declaredUnknowns":["平台与周期主张的外部真实性/适用范围","疑似ASR冲突词的准确原文若OCR不可读","红笔答题是否连续无隐藏剪辑","面罩人物真实身份与IP授权","非语音音频的具体语义/来源/权属","试卷获取路径、平台政策出处、价格/账号/地区条件"]
}
